{
  "$schema": "../../adapters/fallout_new_vegas/dependency-manifest.schema.json",
  "schema_version": 1,
  "game": "fallout-new-vegas",
  "retrieved_at": "2026-09-21",
  "dependencies": [
    {
      "id": "fallout-new-vegas",
      "name": "Fallout: New Vegas",
      "authors": ["Obsidian Entertainment", "Bethesda Softworks"],
      "version": "user-owned Steam or GOG build",
      "minimum_version": null,
      "source_url": "https://store.steampowered.com/app/22380/Fallout_New_Vegas/",
      "license": "Proprietary commercial game",
      "redistribution": "Never redistribute game executables, data, saves, or Bethesda assets.",
      "acquisition": "user-supplied-from-official-source",
      "sha256": null,
      "hash_note": "VRClient records the locally installed FalloutNV.exe hash as build identity; no universal hash is asserted."
    },
    {
      "id": "fnv-4gb-patcher",
      "name": "FNV 4GB Patcher",
      "authors": ["Roy Batty", "LuthienAnarion"],
      "version": "1.5",
      "minimum_version": "1.5",
      "source_url": "https://www.nexusmods.com/newvegas/mods/62552",
      "license": "Custom Nexus permissions; attribution required",
      "redistribution": "Author forbids inclusion in mod packs and third-party re-upload while active; link only.",
      "acquisition": "user-supplied-from-official-source",
      "sha256": null,
      "hash_note": "Nexus does not publish a stable unauthenticated asset hash; verify the user-selected file locally before use."
    },
    {
      "id": "xnvse",
      "name": "xNVSE",
      "authors": ["Ian Patterson", "Stephen Abel", "Paul Connelly", "Hugues LE PORS", "korri123", "cnf13", "jazzisparis", "Demorome", "xNVSE contributors"],
      "version": "6.4.9",
      "minimum_version": "6.3.4",
      "source_url": "https://github.com/xNVSE/NVSE/releases/tag/6.4.9",
      "license": "GPL-3.0",
      "redistribution": "VRClient links to official releases and does not bundle binaries.",
      "acquisition": "user-supplied-from-official-source",
      "sha256": "81fb0638f87b2c822270e37cf2ca118d39e2425f13028f9173b172c5fdb2eb88",
      "hash_note": "Locally computed SHA-256 of the official nvse_6_4_9.7z GitHub release asset retrieved 2026-09-21."
    },
    {
      "id": "jip-pp-ln-nvse",
      "name": "JIP PP LN",
      "authors": ["PistolPayback", "jazzisparis", "LuthienAnarion", "JIP contributors"],
      "version": "57.54",
      "minimum_version": "requires xNVSE 6.2.6 or newer",
      "source_url": "https://www.nexusmods.com/newvegas/mods/88687",
      "license": "GPL-3.0; Nexus distribution terms also apply",
      "redistribution": "Link to the official page; do not bundle the user-selected package.",
      "acquisition": "user-supplied-from-official-source",
      "sha256": null,
      "hash_note": "No stable unauthenticated asset hash was published; this is the maintained fork linked by FNVR V2 upstream."
    },
    {
      "id": "showoff-xnvse",
      "name": "ShowOff xNVSE Plugin",
      "authors": ["Demorome", "ShowOff contributors"],
      "version": "1.84",
      "minimum_version": "requires xNVSE 6.3.0 or newer",
      "source_url": "https://github.com/Demorome/ShowOff-NVSE/releases/tag/1.84",
      "license": "Custom attribution permission with inherited-code caveat",
      "redistribution": "Credit Demorome and honor the permissions of original code authors; VRClient links only.",
      "acquisition": "user-supplied-from-official-source",
      "sha256": "cbf42c1bb315dbdb0729fb88ed65dd1a3ea72a3347ef854d33afed7c8da6fdc5",
      "hash_note": "Locally computed SHA-256 of the official ShowOffNVSE-1.84.zip GitHub release asset retrieved 2026-09-21."
    },
    {
      "id": "fnvr",
      "name": "Fallout: New Virtual Reality and FNVR Tracker",
      "authors": ["iloveusername"],
      "version": "V2",
      "minimum_version": "V2",
      "source_url": "https://github.com/iloveusername/Fallout-New-Virtual-Reality/releases/tag/V2",
      "license": "MIT source license; upstream also requests open-source modifications and credit, and Nexus distribution permissions may impose non-commercial conditions",
      "redistribution": "Credit iloveusername, retain the MIT notice, keep modifications open source, respect any non-commercial Nexus distribution condition, and link to official Nexus/GitHub downloads by default.",
      "acquisition": "user-supplied-from-official-source",
      "sha256": "519621b06c964478e4a4f1862db601e8dafb23a8dee3160bc4f8836929e0be6d",
      "hash_note": "Locally computed SHA-256 of the official V2 tracker executable. The separately supplied Nexus FNVR.esp archive is f9ae95b54ba1008400e3b3389a6aa57f9582be77405799e7b20ca2340bb2153."
    },
    {
      "id": "steamvr",
      "name": "SteamVR",
      "authors": ["Valve Corporation"],
      "version": "current Steam release",
      "minimum_version": null,
      "source_url": "https://store.steampowered.com/app/250820/SteamVR/",
      "license": "Proprietary Steam software",
      "redistribution": "Install through Steam; VRClient does not bundle it or automate Steam credentials.",
      "acquisition": "user-supplied-from-official-source",
      "sha256": null,
      "hash_note": "Steam-managed binaries update independently."
    },
    {
      "id": "virtual-desktop",
      "name": "Virtual Desktop Streamer",
      "authors": ["Virtual Desktop / Guy Godin"],
      "version": "1.34.22 (official page on retrieval date)",
      "minimum_version": null,
      "source_url": "https://www.vrdesktop.net/",
      "license": "Proprietary software",
      "redistribution": "Link only; user installs the Streamer and owns the headset application.",
      "acquisition": "user-supplied-from-official-source",
      "sha256": null,
      "hash_note": "Official installer hash was not published on the page inspected."
    },
    {
      "id": "mod-organizer-2",
      "name": "Mod Organizer 2",
      "authors": ["ModOrganizer2 contributors"],
      "version": "2.5.2",
      "minimum_version": "2.5.2",
      "source_url": "https://github.com/ModOrganizer2/modorganizer/releases/tag/v2.5.2",
      "license": "GPL-3.0",
      "redistribution": "VRClient links to official releases and does not bundle MO2.",
      "acquisition": "user-supplied-from-official-source",
      "sha256": "e6376efd87fd5ddd95aee959405e8f067afa526ea6c2c0c5aa03c5108bf4a815",
      "hash_note": "Locally computed SHA-256 of the official Mod.Organizer-2.5.2.7z GitHub release asset retrieved 2026-09-21."
    }
  ]
}
